<?xml version="1.0" encoding="utf-8"?>
<cardapio xmlns:xst="http://www.w3.org/2001/XMLSchema-instance"
          xmlns="http://cardapio.org"
          xmlns:tns="http://cardapio.org"
          tns:schemaLocation="http://cardapio.org cardapio.xsd">

    <prato id="1">
        <nome>cachorro quente</nome>
        <descricao>cachorro quente Brasileiro</descricao>
        <ingredientes>
            <ingrediente>Cebola</ingrediente>
            <ingrediente>ovo</ingrediente>
            <ingrediente>ketchup</ingrediente>
            <ingrediente>mostarda</ingrediente>
            <ingrediente>pão</ingrediente>
        </ingredientes>
        <preco>8.00</preco>
        <calorias>400</calorias>
        <tempoPreparo>10 minutos</tempoPreparo>
    </prato>
    <prato id="2">
        <nome>bolo de ovos</nome>
        <descricao>bolo de ovos Brasileiro</descricao>
        <ingredientes>
            <ingrediente>Manteiga</ingrediente>
            <ingrediente>fermento</ingrediente>
            <ingrediente>ovos</ingrediente>
            <ingrediente>refrigerante</ingrediente>
        </ingredientes>
        <preco>8.00</preco>
        <calorias>800</calorias>
        <tempoPreparo>17 minutos</tempoPreparo>
    </prato>
    <prato id="3">
        <nome>Lasanha Tradicional</nome>
        <descricao>Lasanha Tradicional</descricao>
        <ingredientes>
            <ingrediente>1 cebola ralada</ingrediente>
            <ingrediente>500 g de massa de lasanha</ingrediente>
            <ingrediente>3 colheres de óleo</ingrediente>
        </ingredientes>
        <preco>8.00</preco>
        <calorias>800</calorias>
        <tempoPreparo>50 minutos</tempoPreparo>
    </prato>
    <prato id="4">
        <nome>Macarronada</nome>
        <descricao>Macarronada</descricao>
        <ingredientes>
            <ingrediente>1 lata de milho verde</ingrediente>
            <ingrediente>1 lata de ervilha</ingrediente>
            <ingrediente>1 lata de molho de tomate</ingrediente>
        </ingredientes>
        <preco>9.00</preco>
        <calorias>600</calorias>
        <tempoPreparo>30 minutos</tempoPreparo>
    </prato>
    <prato id="5">
        <nome>Pizza Mussarela</nome>
        <descricao>Pizza Mussarela tradicional</descricao>
        <ingredientes>
            <ingrediente>1 copo de água morna</ingrediente>
            <ingrediente>500 g de farinha de trigo</ingrediente>
            <ingrediente>1 colher (chá) de açúcar</ingrediente>
        </ingredientes>
        <preco>35.00</preco>
        <calorias>500</calorias>
        <tempoPreparo>20 minutos</tempoPreparo>
    </prato>
    <prato id="6">
        <nome>Pizza de queijo</nome>
        <descricao>Pizza de queijo Brasileiro</descricao>
        <ingredientes>
            <ingrediente>2 xícaras de farinha de trigo</ingrediente>
            <ingrediente>1/2 colher de sal</ingrediente>
            <ingrediente>1/2 colher de sal</ingrediente>
        </ingredientes>
        <preco>30.00</preco>
        <calorias>450</calorias>
        <tempoPreparo>20 minutos</tempoPreparo>
    </prato>
</cardapio>